{
  "credits": [
    "Copyright © 1993, 2002, 2018 by Eugene H. Peterson",
    "Nueva Biblia de las Américas™ NBLA™ Copyright © 2005 por The Lockman Foundation"
  ],
  "jewels": [
    {
      "explanation": "Toda la humanidad es convocada a reconocer con alegría el reinado de Dios. La NBLA establece que el llamado se dirige a «pueblos todos» y que la respuesta incluye palmas y voces de júbilo. MSG vuelve la escena semejante a una ovación pública ofrecida al verdadero Rey. La expresión no convierte la adoración en espectáculo; comunica que la grandeza de Dios merece una respuesta completa, visible y comunitaria.",
      "id": "salmos47-joya-01",
      "msg": {
        "en": "\"Applause, everyone. Bravo, bravissimo!\"",
        "es": "\"¡Aplausos, todos! ¡Bravo, bravísimo!\""
      },
      "nblaRefs": [
        {
          "fullVerse": true,
          "verseId": "salmos47-nbla-01"
        }
      ],
      "order": 1,
      "range": "1"
    },
    {
      "explanation": "Dios gobierna con majestad sobre toda la creación. La NBLA fija Su identidad como Altísimo y gran Rey sobre la tierra. MSG hace visible esa supremacía presentándolo elevado sobre tierra y océano, sin territorio fuera de Su dominio. La imagen no describe físicamente a Dios ni autoriza representaciones literales; comunica Su soberanía total.",
      "id": "salmos47-joya-02",
      "msg": {
        "en": "\"GOD Most High is stunning, astride land and ocean.\"",
        "es": "\"El DIOS Altísimo es imponente; se alza sobre la tierra y el océano.\""
      },
      "nblaRefs": [
        {
          "fullVerse": true,
          "verseId": "salmos47-nbla-02"
        }
      ],
      "order": 2,
      "range": "2"
    },
    {
      "explanation": "La ascensión de Dios representa Su entronización pública como Rey. La NBLA conserva el ascenso, las aclamaciones y el sonido de la trompeta. MSG desarrolla la escena como una procesión que alcanza la cumbre entre ovaciones. El lenguaje puede reflejar una celebración litúrgica, pero la verdad teológica no depende de reconstruir una ceremonia concreta: el Señor ocupa el trono y Su pueblo lo proclama.",
      "id": "salmos47-joya-03",
      "msg": {
        "en": "\"Loud cheers as God climbs the mountain, a ram’s horn blast at the summit.\"",
        "es": "\"Dios sube a la montaña entre grandes ovaciones, mientras suena un cuerno de carnero en la cumbre.\""
      },
      "nblaRefs": [
        {
          "fullVerse": true,
          "verseId": "salmos47-nbla-05"
        }
      ],
      "order": 3,
      "range": "5-6"
    },
    {
      "explanation": "La excelencia de la adoración responde a la grandeza del Rey. La NBLA une el reinado universal de Dios con un canto armonioso y comprensible. MSG llama a ofrecer las mejores canciones porque Aquel que las recibe es Señor de toda la tierra. El texto no mide la adoración únicamente por destreza musical; reclama una respuesta cuidada, consciente y digna de la verdad que proclama.",
      "id": "salmos47-joya-04",
      "msg": {
        "en": "\"He’s Lord over earth, so sing your best songs to God.\"",
        "es": "\"Él es Señor de toda la tierra; así que cántenle a Dios sus mejores canciones.\""
      },
      "nblaRefs": [
        {
          "fullVerse": true,
          "verseId": "salmos47-nbla-07"
        }
      ],
      "order": 4,
      "range": "7"
    },
    {
      "explanation": "El reinado de Dios conduce a la reunión de las naciones dentro de la promesa hecha a Abraham. La NBLA conserva la relación entre los príncipes de los pueblos y el pueblo del Dios de Abraham. MSG vuelve visible una asamblea formada por gobernantes procedentes de todas partes. La frase no borra las diferencias entre los pueblos ni enseña una salvación política automática; anticipa el propósito universal de la bendición divina.",
      "id": "salmos47-joya-05",
      "msg": {
        "en": "\"Princes from all over are gathered, people of Abraham’s God.\"",
        "es": "\"Príncipes de todas partes se han reunido: el pueblo del Dios de Abraham.\""
      },
      "nblaRefs": [
        {
          "clauseIds": [
            "salmos47-nbla-09a"
          ],
          "verseId": "salmos47-nbla-09"
        }
      ],
      "order": 5,
      "range": "9"
    }
  ],
  "meta": {
    "book": "SALMOS",
    "bookId": "salmos",
    "chapter": 47,
    "studyId": "salmos-47"
  },
  "msgBlocks": [
    {
      "editorialRange": "1-9",
      "id": "salmos47-msg-01",
      "msg": {
        "en": "Applause, everyone. Bravo, bravissimo!\nShout God-songs at the top of your lungs!\nGOD Most High is stunning,\nastride land and ocean.\nHe crushes hostile people,\nputs nations at our feet.\nHe set us at the head of the line,\nprize-winning Jacob, his favorite.\nLoud cheers as God climbs the mountain,\na ram’s horn blast at the summit.\nSing songs to God, sing out!\nSing to our King, sing praise!\nHe’s Lord over earth,\nso sing your best songs to God.\nGod is Lord of godless nations—\nsovereign, he’s King of the mountain.\nPrinces from all over are gathered,\npeople of Abraham’s God.\nThe powers of earth are God’s—\nhe soars over all.",
        "es": "¡Aplausos, todos! ¡Bravo, bravísimo!\n¡Canten canciones a Dios a todo pulmón!\nEl DIOS Altísimo es imponente;\nse alza sobre la tierra y el océano.\nÉl aplasta a los pueblos hostiles\ny pone naciones bajo nuestros pies.\nNos puso al frente de la fila:\nJacob, su favorito, el ganador del gran premio.\nDios sube a la montaña entre grandes ovaciones,\nmientras suena un cuerno de carnero en la cumbre.\n¡Canten canciones a Dios, canten con fuerza!\n¡Cántenle a nuestro Rey, cántenle alabanzas!\nÉl es Señor de toda la tierra;\nasí que cántenle a Dios sus mejores canciones.\nDios es Señor incluso de las naciones sin Dios;\nsoberano, Él es el Rey de la montaña.\nPríncipes de todas partes se han reunido:\nel pueblo del Dios de Abraham.\nLos poderes de la tierra le pertenecen a Dios;\nÉl se eleva por encima de todos."
      },
      "nblaRefs": [
        {
          "fullVerse": true,
          "verseId": "salmos47-nbla-01"
        },
        {
          "fullVerse": true,
          "verseId": "salmos47-nbla-02"
        },
        {
          "fullVerse": true,
          "verseId": "salmos47-nbla-03"
        },
        {
          "fullVerse": true,
          "verseId": "salmos47-nbla-04"
        },
        {
          "fullVerse": true,
          "verseId": "salmos47-nbla-05"
        },
        {
          "fullVerse": true,
          "verseId": "salmos47-nbla-06"
        },
        {
          "fullVerse": true,
          "verseId": "salmos47-nbla-07"
        },
        {
          "fullVerse": true,
          "verseId": "salmos47-nbla-08"
        },
        {
          "fullVerse": true,
          "verseId": "salmos47-nbla-09"
        }
      ],
      "order": 1
    }
  ],
  "nblaVerses": [
    {
      "id": "salmos47-nbla-01",
      "number": 1,
      "text": "Batan palmas, pueblos todos;\nAclamen a Dios con voz de júbilo."
    },
    {
      "id": "salmos47-nbla-02",
      "number": 2,
      "text": "Porque el SEÑOR, el Altísimo, es digno de ser temido;\nRey grande es sobre toda la tierra."
    },
    {
      "id": "salmos47-nbla-03",
      "number": 3,
      "text": "Él somete pueblos debajo de nosotros,\nY naciones bajo nuestros pies."
    },
    {
      "id": "salmos47-nbla-04",
      "number": 4,
      "text": "Él nos escoge nuestra heredad,\nLa gloria de Jacob a quien Él ama. (Selah)"
    },
    {
      "id": "salmos47-nbla-05",
      "number": 5,
      "text": "Dios ha ascendido entre aclamaciones,\nEl SEÑOR, al son de trompeta."
    },
    {
      "id": "salmos47-nbla-06",
      "number": 6,
      "text": "Canten alabanzas a Dios, canten alabanzas;\nCanten alabanzas a nuestro Rey, canten alabanzas."
    },
    {
      "id": "salmos47-nbla-07",
      "number": 7,
      "text": "Porque Dios es Rey de toda la tierra;\nCanten alabanzas con armonioso salmo."
    },
    {
      "id": "salmos47-nbla-08",
      "number": 8,
      "text": "Dios reina sobre las naciones;\nSentado está Dios en Su santo trono."
    },
    {
      "clauses": [
        {
          "id": "salmos47-nbla-09a",
          "order": 1,
          "text": "Se han reunido los príncipes de los pueblos como el pueblo del Dios de Abraham;"
        },
        {
          "id": "salmos47-nbla-09b",
          "order": 2,
          "separatorBefore": "\n",
          "text": "Porque de Dios son los escudos de la tierra;\nÉl es ensalzado en gran manera."
        }
      ],
      "id": "salmos47-nbla-09",
      "number": 9
    }
  ],
  "schemaVersion": "1.0.0",
  "sources": {
    "msg": {
      "id": "msg",
      "name": "The Message",
      "originalLanguage": "en",
      "role": "editorial",
      "translatedLanguage": "es"
    },
    "nbla": {
      "id": "nbla",
      "language": "es",
      "name": "Nueva Biblia de las Américas",
      "role": "canonical-reference"
    }
  }
}
