{
  "credits": [
    "Copyright © 1993, 2002, 2018 by Eugene H. Peterson",
    "Nueva Biblia de las Américas™ NBLA™ Copyright © 2005 por The Lockman Foundation"
  ],
  "jewels": [
    {
      "explanation": "El nombre del SEÑOR representa Su identidad, carácter y reputación revelada. La NBLA establece el mandato de alabar Su nombre; MSG expresa pastoralmente que recordarlo y pronunciarlo con verdad dirige el corazón hacia la adoración. La frase no convierte la repetición mecánica de un nombre en alabanza, sino que destaca que conocer quién es Dios despierta una respuesta reverente.",
      "id": "salmos113-joya-01",
      "msg": {
        "en": "“Just to speak his name is praise!”",
        "es": "“¡Solo pronunciar Su nombre ya es alabanza!”"
      },
      "nblaRefs": [
        {
          "clauseIds": [
            "salmos113-nbla-01b"
          ],
          "verseId": "salmos113-nbla-01"
        }
      ],
      "order": 1,
      "range": "1-3"
    },
    {
      "explanation": "La dignidad de Dios no está limitada por el tiempo. La NBLA afirma la permanencia de Su alabanza; MSG vuelve esa continuidad cercana al recorrer el presente, el futuro inmediato y el siempre. El texto no exige una actividad verbal ininterrumpida, sino una vida cuya orientación constante reconoce que Dios continúa siendo digno en cada temporada.",
      "id": "salmos113-joya-02",
      "msg": {
        "en": "“now and tomorrow and always.”",
        "es": "“ahora, mañana y siempre.”"
      },
      "nblaRefs": [
        {
          "clauseIds": [
            "salmos113-nbla-02b"
          ],
          "verseId": "salmos113-nbla-02"
        }
      ],
      "order": 2,
      "range": "1-3"
    },
    {
      "explanation": "Dios es absolutamente incomparable. La NBLA conserva la pregunta central del salmo y MSG comunica su fuerza directa: ninguna nación, poder, autoridad o realidad creada puede ponerse a Su nivel. Esta incomparabilidad no debe convertirse en una idea abstracta; prepara al lector para comprender que el Dios más alto es también quien decide inclinarse hacia el necesitado.",
      "id": "salmos113-joya-03",
      "msg": {
        "en": "“Who can compare with GOD, our God,”",
        "es": "“¿Quién puede compararse con DIOS, nuestro Dios,”"
      },
      "nblaRefs": [
        {
          "clauseIds": [
            "salmos113-nbla-05a"
          ],
          "verseId": "salmos113-nbla-05"
        }
      ],
      "order": 3,
      "range": "4-6"
    },
    {
      "explanation": "El Dios exaltado interviene personalmente para restaurar al humillado. La NBLA fija con precisión la acción de levantar al pobre; MSG conserva la misma imagen y la vuelve inmediata. El texto no promete ascenso social automático para toda persona pobre, pero sí declara que Dios ve, valora y puede cambiar la condición de quienes otros dejan en el suelo.",
      "id": "salmos113-joya-04",
      "msg": {
        "en": "“He picks up the poor from out of the dirt,”",
        "es": "“Él levanta al pobre del polvo,”"
      },
      "nblaRefs": [
        {
          "clauseIds": [
            "salmos113-nbla-07a"
          ],
          "verseId": "salmos113-nbla-07"
        }
      ],
      "order": 4,
      "range": "7-8"
    },
    {
      "explanation": "Dios presta atención a la ausencia, la soledad y el dolor relacionados con no tener hijos. La NBLA mantiene el foco textual en la mujer estéril a quien Dios concede un hogar gozoso; MSG amplía pastoralmente la imagen hacia una pareja sin hijos que recibe familia. Esa ampliación no debe convertirse en una promesa universal de fertilidad biológica; el énfasis teológico permanece en el Dios que ve el vacío y puede crear pertenencia y alegría.",
      "id": "salmos113-joya-05",
      "msg": {
        "en": "“He gives childless couples a family,”",
        "es": "“A las parejas sin hijos les da una familia,”"
      },
      "nblaRefs": [
        {
          "clauseIds": [
            "salmos113-nbla-09a"
          ],
          "verseId": "salmos113-nbla-09"
        }
      ],
      "order": 5,
      "range": "9"
    }
  ],
  "meta": {
    "book": "SALMOS",
    "bookId": "salmos",
    "chapter": 113,
    "studyId": "salmos-113"
  },
  "msgBlocks": [
    {
      "editorialRange": "1-3",
      "id": "salmos113-msg-01",
      "msg": {
        "en": "Hallelujah!\nYou who serve GOD, praise GOD!\nJust to speak his name is praise!\nJust to remember GOD is a blessing—\nnow and tomorrow and always.\nFrom east to west, from dawn to dusk,\nkeep lifting all your praises to GOD!",
        "es": "¡Aleluya!\nUstedes que sirven a DIOS, ¡alaben a DIOS!\n¡Solo pronunciar Su nombre ya es alabanza!\nSolo recordar a DIOS es una bendición—\nahora, mañana y siempre.\nDesde el oriente hasta el occidente, desde el amanecer hasta el anochecer,\n¡sigan elevando toda su alabanza a DIOS!"
      },
      "nblaRefs": [
        {
          "fullVerse": true,
          "verseId": "salmos113-nbla-01"
        },
        {
          "fullVerse": true,
          "verseId": "salmos113-nbla-02"
        },
        {
          "fullVerse": true,
          "verseId": "salmos113-nbla-03"
        }
      ],
      "order": 1
    },
    {
      "editorialRange": "4-9",
      "id": "salmos113-msg-02",
      "msg": {
        "en": "GOD is higher than anything and anyone,\noutshining everything you can see in the skies.\nWho can compare with GOD, our God,\nso majestically enthroned,\nSurveying his magnificent\nheavens and earth?\nHe picks up the poor from out of the dirt,\nrescues the wretched who’ve been thrown out with the trash,\nSeats them among the honored guests,\na place of honor among the brightest and best.\nHe gives childless couples a family,\ngives them joy as the parents of children.\nHallelujah!",
        "es": "DIOS está por encima de todo y de todos,\nSu resplandor supera todo lo que pueden ver en los cielos.\n¿Quién puede compararse con DIOS, nuestro Dios,\nentronizado con tanta majestad,\ncontemplando Sus magníficos\ncielos y tierra?\nÉl levanta al pobre del polvo,\nrescata al miserable que fue arrojado a la basura,\nlo sienta entre los invitados de honor,\nle da un lugar de honor entre los mejores y más destacados.\nA las parejas sin hijos les da una familia,\nles da la alegría de ser padres.\n¡Aleluya!"
      },
      "nblaRefs": [
        {
          "fullVerse": true,
          "verseId": "salmos113-nbla-04"
        },
        {
          "fullVerse": true,
          "verseId": "salmos113-nbla-05"
        },
        {
          "fullVerse": true,
          "verseId": "salmos113-nbla-06"
        },
        {
          "fullVerse": true,
          "verseId": "salmos113-nbla-07"
        },
        {
          "fullVerse": true,
          "verseId": "salmos113-nbla-08"
        },
        {
          "fullVerse": true,
          "verseId": "salmos113-nbla-09"
        }
      ],
      "order": 2
    }
  ],
  "nblaVerses": [
    {
      "clauses": [
        {
          "id": "salmos113-nbla-01a",
          "order": 1,
          "text": "¡Aleluya!\nAlaben, siervos del SEÑOR,"
        },
        {
          "id": "salmos113-nbla-01b",
          "order": 2,
          "separatorBefore": "\n",
          "text": "Alaben el nombre del SEÑOR."
        }
      ],
      "id": "salmos113-nbla-01",
      "number": 1
    },
    {
      "clauses": [
        {
          "id": "salmos113-nbla-02a",
          "order": 1,
          "text": "Bendito sea el nombre del SEÑOR"
        },
        {
          "id": "salmos113-nbla-02b",
          "order": 2,
          "separatorBefore": "\n",
          "text": "Desde ahora y para siempre."
        }
      ],
      "id": "salmos113-nbla-02",
      "number": 2
    },
    {
      "id": "salmos113-nbla-03",
      "number": 3,
      "text": "Desde el nacimiento del sol hasta su ocaso,\nAlabado sea el nombre del SEÑOR."
    },
    {
      "id": "salmos113-nbla-04",
      "number": 4,
      "text": "Excelso sobre todas las naciones es el SEÑOR;\nSu gloria está sobre los cielos."
    },
    {
      "clauses": [
        {
          "id": "salmos113-nbla-05a",
          "order": 1,
          "text": "¿Quién es como el SEÑOR nuestro Dios,"
        },
        {
          "id": "salmos113-nbla-05b",
          "order": 2,
          "separatorBefore": "\n",
          "text": "Que está sentado en las alturas,"
        }
      ],
      "id": "salmos113-nbla-05",
      "number": 5
    },
    {
      "id": "salmos113-nbla-06",
      "number": 6,
      "text": "Que se humilla para mirar\nLo que hay en el cielo y en la tierra?"
    },
    {
      "clauses": [
        {
          "id": "salmos113-nbla-07a",
          "order": 1,
          "text": "Él levanta al pobre del polvo,"
        },
        {
          "id": "salmos113-nbla-07b",
          "order": 2,
          "separatorBefore": "\n",
          "text": "Y al necesitado saca del muladar,"
        }
      ],
      "id": "salmos113-nbla-07",
      "number": 7
    },
    {
      "id": "salmos113-nbla-08",
      "number": 8,
      "text": "Para sentarlos con príncipes,\nCon los príncipes de Su pueblo."
    },
    {
      "clauses": [
        {
          "id": "salmos113-nbla-09a",
          "order": 1,
          "text": "Hace habitar en casa a la mujer estéril,"
        },
        {
          "id": "salmos113-nbla-09b",
          "order": 2,
          "separatorBefore": "\n",
          "text": "Gozosa de ser madre de hijos.\n¡Aleluya!"
        }
      ],
      "id": "salmos113-nbla-09",
      "number": 9
    }
  ],
  "schemaVersion": "1.0.0",
  "sources": {
    "msg": {
      "id": "msg",
      "name": "The Message",
      "originalLanguage": "en",
      "role": "editorial",
      "translatedLanguage": "es"
    },
    "nbla": {
      "id": "nbla",
      "language": "es",
      "name": "Nueva Biblia de las Américas",
      "role": "canonical-reference"
    }
  }
}
