{
  "credits": [
    "Copyright © 1993, 2002, 2018 by Eugene H. Peterson",
    "Nueva Biblia de las Américas™ NBLA™ Copyright © 2005 por The Lockman Foundation"
  ],
  "jewels": [
    {
      "explanation": "La bendición comienza en la gracia y la presencia favorable de Dios. La NBLA fija el sentido mediante la misericordia, la bendición y el rostro resplandeciente del Señor. MSG vuelve esa cercanía visible con la petición «¡Sonríenos!». La imagen no reduce a Dios a una emoción humana pasajera; comunica Su aceptación, favor y presencia sobre el pueblo.",
      "id": "salmos67-joya-01",
      "msg": {
        "en": "\"God, mark us with grace and blessing! Smile!\"",
        "es": "\"Dios, márcanos con gracia y bendición. ¡Sonríenos!\""
      },
      "nblaRefs": [
        {
          "clauseIds": [
            "salmos67-nbla-01a"
          ],
          "verseId": "salmos67-nbla-01"
        }
      ],
      "order": 1,
      "range": "1-2"
    },
    {
      "explanation": "La salvación de Dios está destinada a ser conocida más allá de Israel. La NBLA declara que Su salvación debe hacerse visible entre las naciones. MSG enfatiza que incluso quienes todavía viven sin Dios pueden observar cómo actúa. La bendición del pueblo no es el destino final, sino una ventana hacia la obra salvadora del Señor.",
      "id": "salmos67-joya-02",
      "msg": {
        "en": "\"all the godless nations see how you save.\"",
        "es": "\"todas las naciones que viven sin Dios verán cómo salvas.\""
      },
      "nblaRefs": [
        {
          "clauseIds": [
            "salmos67-nbla-02b"
          ],
          "verseId": "salmos67-nbla-02"
        }
      ],
      "order": 2,
      "range": "1-2"
    },
    {
      "explanation": "El gobierno de Dios produce una alegría que alcanza los lugares más distantes. La NBLA invita a las naciones a alegrarse y cantar. MSG amplía la escena mostrando a pueblos lejanos gritando su felicidad. El gozo no nace de una emoción religiosa fabricada, sino de vivir bajo la justicia y dirección del Dios verdadero.",
      "id": "salmos67-joya-03",
      "msg": {
        "en": "\"Let all far-flung people become happy and shout their happiness\"",
        "es": "\"Que los pueblos de los lugares más lejanos se alegren y griten de felicidad\""
      },
      "nblaRefs": [
        {
          "clauseIds": [
            "salmos67-nbla-04a"
          ],
          "verseId": "salmos67-nbla-04"
        }
      ],
      "order": 3,
      "range": "3-5"
    },
    {
      "explanation": "Dios gobierna con equidad y cuidado. La NBLA mantiene unidas Su justicia y Su dirección sobre las naciones. MSG expresa esa combinación como juzgar limpiamente y cuidar incluso a los pueblos más lejanos. La justicia divina no es indiferente ni meramente punitiva; pertenece al gobierno del Rey que guía correctamente a los pueblos.",
      "id": "salmos67-joya-04",
      "msg": {
        "en": "\"You judge them fair and square, you tend the far-flung peoples.\"",
        "es": "\"Tú los juzgas con total justicia y cuidas a los pueblos más distantes.\""
      },
      "nblaRefs": [
        {
          "clauseIds": [
            "salmos67-nbla-04b"
          ],
          "verseId": "salmos67-nbla-04"
        }
      ],
      "order": 4,
      "range": "3-5"
    },
    {
      "explanation": "La fertilidad de la tierra manifiesta la generosidad del Creador. La NBLA relaciona directamente el fruto con la bendición de Dios. MSG personifica a la tierra invitándola a exhibir toda su vitalidad. La imagen no promete cosechas abundantes en cada circunstancia individual, sino que celebra la capacidad de la creación para florecer bajo el cuidado divino.",
      "id": "salmos67-joya-05",
      "msg": {
        "en": "\"Earth, display your exuberance!\"",
        "es": "\"¡Tierra, muestra toda tu exuberancia!\""
      },
      "nblaRefs": [
        {
          "fullVerse": true,
          "verseId": "salmos67-nbla-06"
        }
      ],
      "order": 5,
      "range": "6-7"
    }
  ],
  "meta": {
    "book": "SALMOS",
    "bookId": "salmos",
    "chapter": 67,
    "studyId": "salmos-67"
  },
  "msgBlocks": [
    {
      "editorialRange": "1-7",
      "id": "salmos67-msg-01",
      "msg": {
        "en": "God, mark us with grace\nand blessing! Smile!\nThe whole country will see how you work,\nall the godless nations see how you save.\nGod! Let people thank and enjoy you.\nLet all people thank and enjoy you.\nLet all far-flung people become happy\nand shout their happiness because\nYou judge them fair and square,\nyou tend the far-flung peoples.\nGod! Let people thank and enjoy you.\nLet all people thank and enjoy you.\nEarth, display your exuberance!\nYou mark us with blessing, O God, our God.\nYou mark us with blessing, O God.\nEarth’s four corners—honor him!",
        "es": "Dios, márcanos con gracia\ny bendición. ¡Sonríenos!\nTodo el país verá cómo actúas;\ntodas las naciones que viven sin Dios verán cómo salvas.\n¡Dios! Que los pueblos te den gracias y disfruten de Ti.\nQue todos los pueblos te den gracias y disfruten de Ti.\nQue los pueblos de los lugares más lejanos se alegren\ny griten de felicidad porque\nTú los juzgas con total justicia\ny cuidas a los pueblos más distantes.\n¡Dios! Que los pueblos te den gracias y disfruten de Ti.\nQue todos los pueblos te den gracias y disfruten de Ti.\n¡Tierra, muestra toda tu exuberancia!\nNos marcas con bendición, oh Dios, nuestro Dios.\nNos marcas con bendición, oh Dios.\n¡Que los cuatro rincones de la tierra lo honren!"
      },
      "nblaRefs": [
        {
          "fullVerse": true,
          "verseId": "salmos67-nbla-01"
        },
        {
          "fullVerse": true,
          "verseId": "salmos67-nbla-02"
        },
        {
          "fullVerse": true,
          "verseId": "salmos67-nbla-03"
        },
        {
          "fullVerse": true,
          "verseId": "salmos67-nbla-04"
        },
        {
          "fullVerse": true,
          "verseId": "salmos67-nbla-05"
        },
        {
          "fullVerse": true,
          "verseId": "salmos67-nbla-06"
        },
        {
          "fullVerse": true,
          "verseId": "salmos67-nbla-07"
        }
      ],
      "order": 1
    }
  ],
  "nblaVerses": [
    {
      "clauses": [
        {
          "id": "salmos67-nbla-01a",
          "order": 1,
          "text": "Dios tenga piedad de nosotros y nos bendiga,\nY haga resplandecer Su rostro sobre nosotros"
        },
        {
          "id": "salmos67-nbla-01b",
          "order": 2,
          "text": ", (Selah)"
        }
      ],
      "id": "salmos67-nbla-01",
      "number": 1
    },
    {
      "clauses": [
        {
          "id": "salmos67-nbla-02a",
          "order": 1,
          "text": "Para que sea conocido en la tierra Tu camino,"
        },
        {
          "id": "salmos67-nbla-02b",
          "order": 2,
          "separatorBefore": "\n",
          "text": "Entre todas las naciones Tu salvación."
        }
      ],
      "id": "salmos67-nbla-02",
      "number": 2
    },
    {
      "id": "salmos67-nbla-03",
      "number": 3,
      "text": "Te den gracias los pueblos, oh Dios,\nTodos los pueblos te den gracias."
    },
    {
      "clauses": [
        {
          "id": "salmos67-nbla-04a",
          "order": 1,
          "text": "Alégrense y canten con júbilo las naciones"
        },
        {
          "id": "salmos67-nbla-04b",
          "order": 2,
          "text": ",\nPorque Tú juzgarás a los pueblos con equidad,\nY guiarás a las naciones en la tierra."
        },
        {
          "id": "salmos67-nbla-04c",
          "order": 3,
          "separatorBefore": " ",
          "text": "(Selah)"
        }
      ],
      "id": "salmos67-nbla-04",
      "number": 4
    },
    {
      "id": "salmos67-nbla-05",
      "number": 5,
      "text": "Te den gracias los pueblos, oh Dios,\nTodos los pueblos te den gracias."
    },
    {
      "id": "salmos67-nbla-06",
      "number": 6,
      "text": "La tierra ha dado su fruto;\nDios, nuestro Dios, nos bendice."
    },
    {
      "id": "salmos67-nbla-07",
      "number": 7,
      "text": "Dios nos bendice,\nPara que le teman todos los términos de la tierra."
    }
  ],
  "schemaVersion": "1.0.0",
  "sources": {
    "msg": {
      "id": "msg",
      "name": "The Message",
      "originalLanguage": "en",
      "role": "editorial",
      "translatedLanguage": "es"
    },
    "nbla": {
      "id": "nbla",
      "language": "es",
      "name": "Nueva Biblia de las Américas",
      "role": "canonical-reference"
    }
  }
}
