{
  "credits": [
    "Copyright © 1993, 2002, 2018 by Eugene H. Peterson",
    "Nueva Biblia de las Américas™ NBLA™ Copyright © 2005 por The Lockman Foundation"
  ],
  "jewels": [
    {
      "explanation": "Sión posee una dignidad especial porque Dios decidió amarla y establecer allí Su presencia. La NBLA fija la afirmación en las puertas de Sión; MSG hace visible ese vínculo mediante la imagen de un hogar amado por Dios. La imagen no significa que Dios esté limitado geográficamente a una vivienda, sino que Sión ocupa un lugar particular dentro de Su propósito de pacto.",
      "id": "salmos87-joya-01",
      "msg": {
        "en": "“and oh, how GOD loves his home!”",
        "es": "“¡y cuánto ama DIOS Su hogar!”"
      },
      "nblaRefs": [
        {
          "clauseIds": [
            "salmos87-nbla-02a"
          ],
          "verseId": "salmos87-nbla-02"
        }
      ],
      "order": 1,
      "range": "1-3"
    },
    {
      "explanation": "El conocimiento de Dios comienza a aparecer entre pueblos que estaban fuera de Israel. La NBLA expresa con precisión que existen personas entre Egipto y Babilonia que conocen al SEÑOR. MSG presenta a Dios nombrando los pueblos entre quienes Su nombre ya es reconocido. El énfasis no es que toda nación automáticamente pertenezca a Dios, sino que Su conocimiento atraviesa fronteras que parecían cerradas.",
      "id": "salmos87-joya-02",
      "msg": {
        "en": "“I name them off, those among whom I’m famous:”",
        "es": "“Voy nombrando a aquellos entre quienes soy conocido:”"
      },
      "nblaRefs": [
        {
          "clauseIds": [
            "salmos87-nbla-04a"
          ],
          "verseId": "salmos87-nbla-04"
        }
      ],
      "order": 2,
      "range": "4"
    },
    {
      "explanation": "Dios concede pertenencia a Sión a personas diversas. La NBLA establece el sentido mediante la declaración de que «este y aquel» nacieron en ella. MSG vuelve expansiva la escena con hombres y mujeres apareciendo por todas partes como nuevos ciudadanos. «Nacen de nuevo» es aquí la manera expresiva de MSG de describir esa nueva pertenencia; no debe usarse aisladamente para afirmar que el salmo está enseñando explícitamente la regeneración de Juan 3.",
      "id": "salmos87-joya-03",
      "msg": {
        "en": "“Men and women, right and left, get born again in her!”",
        "es": "“Hombres y mujeres, por todas partes, ¡nacen de nuevo en ella!”"
      },
      "nblaRefs": [
        {
          "clauseIds": [
            "salmos87-nbla-05a"
          ],
          "verseId": "salmos87-nbla-05"
        }
      ],
      "order": 3,
      "range": "5"
    },
    {
      "explanation": "La pertenencia a la ciudad de Dios depende finalmente del reconocimiento de Dios. La NBLA muestra al SEÑOR contando e inscribiendo a los pueblos; MSG representa ese acto mediante un registro donde aparecen sus nombres. La autoridad para definir quién pertenece no está en manos de una élite humana: el propio Dios realiza el censo de Su pueblo.",
      "id": "salmos87-joya-04",
      "msg": {
        "en": "“GOD registers their names in his book:”",
        "es": "“DIOS registra sus nombres en Su libro:”"
      },
      "nblaRefs": [
        {
          "clauseIds": [
            "salmos87-nbla-06a"
          ],
          "verseId": "salmos87-nbla-06"
        }
      ],
      "order": 4,
      "range": "6"
    },
    {
      "explanation": "Sión es celebrada como fuente porque representa la presencia y bendición del Dios que la estableció. La NBLA explicita que allí se encuentran las fuentes de gozo; MSG mantiene la imagen abierta y poderosa de todas las fuentes procediendo de allí. La ciudad no posee vida autónoma: su valor deriva enteramente de Dios y de Su presencia en medio de ella.",
      "id": "salmos87-joya-05",
      "msg": {
        "en": "“All my springs are in you!”",
        "es": "“¡Todas mis fuentes están en ti!”"
      },
      "nblaRefs": [
        {
          "clauseIds": [
            "salmos87-nbla-07b"
          ],
          "verseId": "salmos87-nbla-07"
        }
      ],
      "order": 5,
      "range": "7"
    }
  ],
  "meta": {
    "book": "SALMOS",
    "bookId": "salmos",
    "chapter": 87,
    "studyId": "salmos-87"
  },
  "msgBlocks": [
    {
      "editorialRange": "1-3",
      "id": "salmos87-msg-01",
      "msg": {
        "en": "He founded Zion on the Holy Mountain—\nand oh, how GOD loves his home!\nLoves it far better than all\nthe homes of Jacob put together!\nGod’s hometown—oh!\neveryone there is talking about you!",
        "es": "Él fundó Sión sobre el Monte Santo,\n¡y cuánto ama DIOS Su hogar!\nLo ama mucho más que a todas\nlas demás moradas de Jacob juntas.\nLa ciudad que Dios llama hogar... ¡ah!\n¡todos hablan de ti!"
      },
      "nblaRefs": [
        {
          "fullVerse": true,
          "verseId": "salmos87-nbla-01"
        },
        {
          "fullVerse": true,
          "verseId": "salmos87-nbla-02"
        },
        {
          "fullVerse": true,
          "verseId": "salmos87-nbla-03"
        }
      ],
      "order": 1
    },
    {
      "editorialRange": "4",
      "id": "salmos87-msg-02",
      "msg": {
        "en": "I name them off, those among whom I’m famous:\nEgypt and Babylon,\nalso Philistia,\neven Tyre, along with Cush.\nWord’s getting around; they point them out:\n“This one was born again here!”",
        "es": "Voy nombrando a aquellos entre quienes soy conocido:\nEgipto y Babilonia,\ntambién Filistea,\nincluso Tiro, junto con Cus.\nLa noticia se está extendiendo; los señalan y dicen:\n«¡Este nació de nuevo aquí!»."
      },
      "nblaRefs": [
        {
          "fullVerse": true,
          "verseId": "salmos87-nbla-04"
        }
      ],
      "order": 2
    },
    {
      "editorialRange": "5",
      "id": "salmos87-msg-03",
      "msg": {
        "en": "The word’s getting out on Zion:\n“Men and women, right and left,\nget born again in her!”",
        "es": "La noticia sobre Sión se sigue extendiendo:\n«Hombres y mujeres, por todas partes,\n¡nacen de nuevo en ella!»."
      },
      "nblaRefs": [
        {
          "fullVerse": true,
          "verseId": "salmos87-nbla-05"
        }
      ],
      "order": 3
    },
    {
      "editorialRange": "6",
      "id": "salmos87-msg-04",
      "msg": {
        "en": "GOD registers their names in his book:\n“This one, this one, and this one—\nborn again, right here.”",
        "es": "DIOS registra sus nombres en Su libro:\n«Este, este y este:\nnacieron de nuevo, aquí mismo»."
      },
      "nblaRefs": [
        {
          "fullVerse": true,
          "verseId": "salmos87-nbla-06"
        }
      ],
      "order": 4
    },
    {
      "editorialRange": "7",
      "id": "salmos87-msg-05",
      "msg": {
        "en": "Singers and dancers give credit to Zion:\n“All my springs are in you!”",
        "es": "Cantores y danzantes le dan a Sión todo el crédito:\n«¡Todas mis fuentes están en ti!»."
      },
      "nblaRefs": [
        {
          "fullVerse": true,
          "verseId": "salmos87-nbla-07"
        }
      ],
      "order": 5
    }
  ],
  "nblaVerses": [
    {
      "id": "salmos87-nbla-01",
      "number": 1,
      "text": "En los montes santos están Sus cimientos."
    },
    {
      "clauses": [
        {
          "id": "salmos87-nbla-02a",
          "order": 1,
          "text": "El SEÑOR ama las puertas de Sión"
        },
        {
          "id": "salmos87-nbla-02b",
          "order": 2,
          "separatorBefore": "\n",
          "text": "Más que todas las otras moradas de Jacob."
        }
      ],
      "id": "salmos87-nbla-02",
      "number": 2
    },
    {
      "id": "salmos87-nbla-03",
      "number": 3,
      "text": "Cosas gloriosas se dicen de Ti,\nOh ciudad de Dios: (Selah)"
    },
    {
      "clauses": [
        {
          "id": "salmos87-nbla-04a",
          "order": 1,
          "text": "«Mencionaré a Egipto y a Babilonia entre los que me conocen;"
        },
        {
          "id": "salmos87-nbla-04b",
          "order": 2,
          "separatorBefore": "\n",
          "text": "A Filistea y Tiro con Etiopía. De sus moradores se dirá:\n“Este nació allí”»."
        }
      ],
      "id": "salmos87-nbla-04",
      "number": 4
    },
    {
      "clauses": [
        {
          "id": "salmos87-nbla-05a",
          "order": 1,
          "text": "Pero de Sión se dirá: «Este y aquel nacieron en ella»;"
        },
        {
          "id": "salmos87-nbla-05b",
          "order": 2,
          "separatorBefore": "\n",
          "text": "Y el Altísimo mismo la establecerá."
        }
      ],
      "id": "salmos87-nbla-05",
      "number": 5
    },
    {
      "clauses": [
        {
          "id": "salmos87-nbla-06a",
          "order": 1,
          "text": "El SEÑOR contará al inscribir los pueblos:"
        },
        {
          "id": "salmos87-nbla-06b",
          "order": 2,
          "separatorBefore": "\n",
          "text": "«Este nació allí». (Selah)"
        }
      ],
      "id": "salmos87-nbla-06",
      "number": 6
    },
    {
      "clauses": [
        {
          "id": "salmos87-nbla-07a",
          "order": 1,
          "text": "Entonces tanto los cantores como los flautistas, dirán:\n«"
        },
        {
          "id": "salmos87-nbla-07b",
          "order": 2,
          "text": "En ti están todas mis fuentes de gozo»."
        }
      ],
      "id": "salmos87-nbla-07",
      "number": 7
    }
  ],
  "schemaVersion": "1.0.0",
  "sources": {
    "msg": {
      "id": "msg",
      "name": "The Message",
      "originalLanguage": "en",
      "role": "editorial",
      "translatedLanguage": "es"
    },
    "nbla": {
      "id": "nbla",
      "language": "es",
      "name": "Nueva Biblia de las Américas",
      "role": "canonical-reference"
    }
  }
}
