{
  "credits": [
    "Copyright © 1993, 2002, 2018 by Eugene H. Peterson",
    "Nueva Biblia de las Américas™ NBLA™ Copyright © 2005 por The Lockman Foundation"
  ],
  "jewels": [
    {
      "explanation": "La liberación conduce al gobierno de Dios. La NBLA fija el sentido al declarar que Israel llegó a ser Su dominio; MSG vuelve explícita la santidad de ese gobierno. El texto no enseña superioridad étnica ni poder político autónomo, sino que Dios apartó a un pueblo para habitar en medio de él y ordenar su vida conforme a Su voluntad.",
      "id": "salmos114-joya-01",
      "msg": {
        "en": "“Israel the place of holy rule.”",
        "es": "“Israel, en el lugar de Su gobierno santo.”"
      },
      "nblaRefs": [
        {
          "clauseIds": [
            "salmos114-nbla-02b"
          ],
          "verseId": "salmos114-nbla-02"
        }
      ],
      "order": 1,
      "range": "1-2"
    },
    {
      "explanation": "La creación reconoce la autoridad de su Creador. La NBLA conserva la imagen poética del mar que mira y huye; MSG la dramatiza como una retirada inmediata. No debe interpretarse como miedo literal del mar, sino como una proclamación de que aquello que parecía infranqueable pierde su dominio delante de la presencia de Dios.",
      "id": "salmos114-joya-02",
      "msg": {
        "en": "“Sea took one look and ran the other way;”",
        "es": "“El mar echó una mirada y huyó en dirección contraria;”"
      },
      "nblaRefs": [
        {
          "clauseIds": [
            "salmos114-nbla-03a"
          ],
          "verseId": "salmos114-nbla-03"
        }
      ],
      "order": 2,
      "range": "3"
    },
    {
      "explanation": "La pregunta obliga al lector a buscar la causa detrás del milagro. La NBLA y MSG conservan el desafío directo al mar, pero la respuesta no se encuentra en Israel. El obstáculo retrocedió porque el Señor estaba presente. La fe bíblica no engrandece a quien cruza; engrandece al Dios que abre el camino.",
      "id": "salmos114-joya-03",
      "msg": {
        "en": "“What’s wrong with you, Sea, that you ran away?”",
        "es": "“¿Qué te pasa, mar, que huiste?”"
      },
      "nblaRefs": [
        {
          "clauseIds": [
            "salmos114-nbla-05a"
          ],
          "verseId": "salmos114-nbla-05"
        }
      ],
      "order": 3,
      "range": "5-6"
    },
    {
      "explanation": "La presencia de Dios demanda reverencia universal. La NBLA establece que la tierra tiembla ante el Señor; MSG vuelve inmediata la razón: está delante de Él. El texto no presenta a Dios como una energía impersonal, sino como el Señor soberano y el Dios de Jacob, majestuoso y comprometido con Su pueblo.",
      "id": "salmos114-joya-04",
      "msg": {
        "en": "“Tremble, Earth! You’re in the Lord’s presence!”",
        "es": "“¡Tiembla, tierra! ¡Estás en presencia del Señor,”"
      },
      "nblaRefs": [
        {
          "clauseIds": [
            "salmos114-nbla-07a"
          ],
          "verseId": "salmos114-nbla-07"
        }
      ],
      "order": 4,
      "range": "7"
    },
    {
      "explanation": "Dios puede producir vida donde la creación parece incapaz de sostenerla. La NBLA afirma la transformación de la roca en agua; MSG añade la sensación pastoral de frescura y alivio. Esa ampliación no debe convertirse en una promesa de comodidad permanente, sino en una imagen del poder proveedor de Dios dentro de un camino difícil.",
      "id": "salmos114-joya-05",
      "msg": {
        "en": "“He turned the rock into a pool of cool water,”",
        "es": "“Él convirtió la roca en un estanque de agua fresca;”"
      },
      "nblaRefs": [
        {
          "clauseIds": [
            "salmos114-nbla-08a"
          ],
          "verseId": "salmos114-nbla-08"
        }
      ],
      "order": 5,
      "range": "8"
    }
  ],
  "meta": {
    "book": "SALMOS",
    "bookId": "salmos",
    "chapter": 114,
    "studyId": "salmos-114"
  },
  "msgBlocks": [
    {
      "editorialRange": "1-8",
      "id": "salmos114-msg-01",
      "msg": {
        "en": "After Israel left Egypt,\nthe clan of Jacob left those barbarians behind;\nJudah became holy land for him,\nIsrael the place of holy rule.\nSea took one look and ran the other way;\nRiver Jordan turned around and ran off.\nThe mountains turned playful and skipped like rams,\nthe hills frolicked like spring lambs.\nWhat’s wrong with you, Sea, that you ran away?\nand you, River Jordan, that you turned and ran off?\nAnd mountains, why did you skip like rams?\nand you, hills, frolic like spring lambs?\nTremble, Earth! You’re in the Lord’s presence!\nin the presence of Jacob’s God.\nHe turned the rock into a pool of cool water,\nturned flint into fresh spring water.",
        "es": "Después de que Israel salió de Egipto,\nel clan de Jacob dejó atrás a aquellos bárbaros;\nJudá se convirtió en tierra santa para Él,\nIsrael, en el lugar de Su gobierno santo.\nEl mar echó una mirada y huyó en dirección contraria;\nel río Jordán dio media vuelta y salió corriendo.\nLas montañas se pusieron juguetonas y saltaron como carneros;\nlas colinas retozaron como corderitos.\n¿Qué te pasa, mar, que huiste?\nY tú, río Jordán, ¿por qué diste media vuelta y saliste corriendo?\nY ustedes, montañas, ¿por qué saltaron como carneros?\nY ustedes, colinas, ¿por qué retozaron como corderitos?\n¡Tiembla, tierra! ¡Estás en presencia del Señor,\nen presencia del Dios de Jacob!\nÉl convirtió la roca en un estanque de agua fresca;\nconvirtió el pedernal en agua fresca de manantial."
      },
      "nblaRefs": [
        {
          "fullVerse": true,
          "verseId": "salmos114-nbla-01"
        },
        {
          "fullVerse": true,
          "verseId": "salmos114-nbla-02"
        },
        {
          "fullVerse": true,
          "verseId": "salmos114-nbla-03"
        },
        {
          "fullVerse": true,
          "verseId": "salmos114-nbla-04"
        },
        {
          "fullVerse": true,
          "verseId": "salmos114-nbla-05"
        },
        {
          "fullVerse": true,
          "verseId": "salmos114-nbla-06"
        },
        {
          "fullVerse": true,
          "verseId": "salmos114-nbla-07"
        },
        {
          "fullVerse": true,
          "verseId": "salmos114-nbla-08"
        }
      ],
      "order": 1
    }
  ],
  "nblaVerses": [
    {
      "id": "salmos114-nbla-01",
      "number": 1,
      "text": "Cuando Israel salió de Egipto,\nLa casa de Jacob de entre un pueblo de lengua extraña,"
    },
    {
      "clauses": [
        {
          "id": "salmos114-nbla-02a",
          "order": 1,
          "text": "Judá vino a ser Su santuario,"
        },
        {
          "id": "salmos114-nbla-02b",
          "order": 2,
          "separatorBefore": "\n",
          "text": "Israel, Su dominio."
        }
      ],
      "id": "salmos114-nbla-02",
      "number": 2
    },
    {
      "clauses": [
        {
          "id": "salmos114-nbla-03a",
          "order": 1,
          "text": "Lo miró el mar, y huyó;"
        },
        {
          "id": "salmos114-nbla-03b",
          "order": 2,
          "separatorBefore": "\n",
          "text": "El Jordán se volvió atrás."
        }
      ],
      "id": "salmos114-nbla-03",
      "number": 3
    },
    {
      "id": "salmos114-nbla-04",
      "number": 4,
      "text": "Los montes saltaron como carneros,\nY los collados como corderitos."
    },
    {
      "clauses": [
        {
          "id": "salmos114-nbla-05a",
          "order": 1,
          "text": "¿Qué te pasa, oh mar, que huyes,"
        },
        {
          "id": "salmos114-nbla-05b",
          "order": 2,
          "separatorBefore": "\n",
          "text": "Y a ti, Jordán, que te vuelves atrás,"
        }
      ],
      "id": "salmos114-nbla-05",
      "number": 5
    },
    {
      "id": "salmos114-nbla-06",
      "number": 6,
      "text": "A ustedes, montes, que saltan como carneros,\nY a ustedes, collados, que saltan como corderitos?"
    },
    {
      "clauses": [
        {
          "id": "salmos114-nbla-07a",
          "order": 1,
          "text": "Tiembla, oh tierra, ante la presencia del Señor,"
        },
        {
          "id": "salmos114-nbla-07b",
          "order": 2,
          "separatorBefore": "\n",
          "text": "Ante la presencia del Dios de Jacob,"
        }
      ],
      "id": "salmos114-nbla-07",
      "number": 7
    },
    {
      "clauses": [
        {
          "id": "salmos114-nbla-08a",
          "order": 1,
          "text": "Que convirtió la roca en estanque de agua,"
        },
        {
          "id": "salmos114-nbla-08b",
          "order": 2,
          "separatorBefore": "\n",
          "text": "Y en fuente de aguas el pedernal."
        }
      ],
      "id": "salmos114-nbla-08",
      "number": 8
    }
  ],
  "schemaVersion": "1.0.0",
  "sources": {
    "msg": {
      "id": "msg",
      "name": "The Message",
      "originalLanguage": "en",
      "role": "editorial",
      "translatedLanguage": "es"
    },
    "nbla": {
      "id": "nbla",
      "language": "es",
      "name": "Nueva Biblia de las Américas",
      "role": "canonical-reference"
    }
  }
}
